{
  "schema": "heptatrader.module-manifest.v3",
  "id": "hepta.numeric.core",
  "version": "1.0.0",
  "lifecycle": "current",
  "kind": "contract-library",
  "trust_domain": "shared-trusted",
  "authority": "fixed numeric boundary",
  "ownership_mode": "exclusive",
  "source_roots": [
    "HeptaTrade/numeric/"
  ],
  "build_targets": [
    "hepta_numeric_core"
  ],
  "provides": [
    "hepta.numeric.fixed-v1"
  ],
  "consumes": [],
  "allowed_dependencies": [],
  "forbidden_dependencies": [
    "*"
  ],
  "state": {
    "model": "none",
    "persistence": "none",
    "writer": "single-owner"
  },
  "concurrency": {
    "model": "pure-reentrant",
    "shard_key": "none",
    "blocking_io": "forbidden",
    "cross_module_lock": "forbidden"
  },
  "backpressure": {
    "class": "caller-bounded",
    "overflow": "typed-failure"
  },
  "failure": {
    "risk_increase": "fail-closed",
    "safe_exit": "never-weaken"
  },
  "resource_budget": "numeric-core-v1",
  "owners": {
    "dri": "@hepta/contracts",
    "backup": "@hepta/risk",
    "reviewers": [
      "@hepta/architecture"
    ]
  },
  "verification": [
    "numeric-negative",
    "numeric-properties",
    "module-documentation-coverage"
  ],
  "documentation": {
    "technical_guide": "modules/technical/hepta-numeric-core.md",
    "coverage_topics": [
      "purpose-scope",
      "responsibilities-boundaries",
      "trust-authority",
      "source-build",
      "contracts-interfaces",
      "state-data",
      "concurrency-ordering-backpressure",
      "failure-recovery",
      "configuration-compatibility",
      "observability-resources",
      "security",
      "verification-testing",
      "operations-rollout-gaps"
    ]
  }
}
